{
  "id": "pilea_moon_valley",
  "common_name": "Moon Valley Pilea",
  "scientific_name": "Pilea mollis 'Moon Valley'",
  "tags": [
    "indoor",
    "easy",
    "bright indirect",
    "pups",
    "compact",
    "foliage"
  ],
  "care": {
    "summary": "Textured quilted leaves; compact bushy habit.",
    "light": "Bright indirect; avoid harsh midday sun",
    "water": "When top 2 cm dry; even moisture preferred",
    "soil": "Well-draining potting mix",
    "humidity": "Average to moderate",
    "temperature_c": "16-28",
    "fertilizer": "Monthly dilute feed in growing season",
    "toxicity": "Generally considered non-toxic; not food",
    "common_issues": [
      "Droopy leaves from underwatering",
      "Leggy growth in low light",
      "Crispy edges from dry air"
    ],
    "tips": [
      "Rotate for even growth",
      "Propagate offsets in water",
      "Dust leaves monthly"
    ]
  }
}
